{
  "$schema": "https://json-schema.org/draft/2020-12/schema",
  "$id": "https://padrao-laudos-periciais.local/schemas/capability-exception-v1.schema.json",
  "type": "object", "additionalProperties": false,
  "required": ["schemaVersion", "policyVersion", "analyzerVersion", "ruleVersion", "findingCode", "capabilityClass", "canonicalPath", "module", "acquisitionLocation", "normalizedAcquisitionAstSha256", "wholeFileSha256", "baselineCommit", "acquiredCapability", "justification", "owner", "reviewEvidence", "disposition", "reviewBy"],
  "properties": {
    "schemaVersion": {"const": "1.0.0"}, "policyVersion": {"const": "1.0.0"}, "analyzerVersion": {"type": "string", "minLength": 1}, "ruleVersion": {"type": "string", "minLength": 1},
    "findingCode": {"type": "string", "minLength": 1}, "capabilityClass": {"type": "string", "minLength": 1},
    "canonicalPath": {"type": "string", "pattern": "^(?!.*(?:\\*|\\.\\.)).+\\.py$"}, "module": {"type": "string", "pattern": "^[a-zA-Z_][a-zA-Z0-9_.]*$"},
    "acquisitionLocation": {"type": "object", "additionalProperties": false, "required": ["line", "column"], "properties": {"line": {"type": "integer", "minimum": 1}, "column": {"type": "integer", "minimum": 0}}},
    "normalizedAcquisitionAstSha256": {"type": "string", "pattern": "^[0-9a-f]{64}$"}, "wholeFileSha256": {"type": "string", "pattern": "^[0-9a-f]{64}$"}, "baselineCommit": {"type": "string", "pattern": "^[0-9a-f]{40}$"},
    "acquiredCapability": {"type": "string", "minLength": 1}, "justification": {"type": "string", "minLength": 20}, "owner": {"type": "string", "minLength": 1},
    "reviewEvidence": {"type": "string", "minLength": 1}, "disposition": {"enum": ["ACCEPT_BASELINE", "REMOVE_BY_EXPIRY"]}, "reviewBy": {"type": "string", "format": "date"}
  }
}
